Filename From Zip,Source URL,Post Date/Time,Username,Followers,Engagement Rate,Like Count,Comment Count,Location,Post Type,Caption,Hashtags,Mentions,Image/Video URL
dea_2020_project_-CGv4r1oAw_3.jpg,https://www.instagram.com/p/CGv4r1oAw_3,10/25/2020,dea_2020_project_,4,0.5,2,0,,image,"This photo relates to the HER process Environmental Stress. As they study, the students are experiencing environmental stress of the COVID-19 safety measures such as wearing face masks, maintaining physical distance, and keeping group size small. Change in routine for college students has a psychological and social cost that creates stress. #envpsy #envpsyw1","envpsy, envpsyw1",,https://instagram.fmnl16-1.fna.fbcdn.net/v/t51.2885-15/e35/s1080x1080/122468621_138221444669868_8613215514592402451_n.jpg?_nc_ht=instagram.fmnl16-1.fna.fbcdn.net&_nc_cat=100&_nc_ohc=cvWaOzWKwYIAX-HnijT&tp=1&oh=8e2e75ba3e10965e572ffb4e349438ad&oe=5FFD9DD2
natures_aed-CGsaerCAzKy.jpg,https://www.instagram.com/p/CGsaerCAzKy,10/23/2020,natures_aed,2,2.5,3,2,"Ogunquit, Maine",image,"My current backyard relates to the HER process of environmental stress in the form of noise. Water carries noise very effectively. Since the Ogunquit river is so close to my backyard, I often hear sirens and delivery trucks as the water carries these sounds from downtown. Additionally, the woodlands are full of noises from birds and wildlife. I haven’t adapted well to the artificial sounds of sirens and trucks. However, I find myself better at identifying bird species because I’m exposed to many varieties of birds.
#envpsy #envpsy1 #envpsyw1","envpsy, envpsy1, envpsyw1",,https://instagram.fbga3-1.fna.fbcdn.net/v/t51.2885-15/e35/p1080x1080/122426883_447615876211063_8798196503476471309_n.jpg?_nc_ht=instagram.fbga3-1.fna.fbcdn.net&_nc_cat=107&_nc_ohc=mPP9hlwUG60AX9hvMvv&tp=1&oh=acdf4760312ce4a62d57d82463cdf34f&oe=5FFD3F85
itsalex.hey_how_are_ya-CGi7uPBDaRh.jpg,https://www.instagram.com/p/CGi7uPBDaRh,10/20/2020,itsalex.hey_how_are_ya,18,0.2222,0,4,,image,This is an example of Defensible space. The room is only assessable to students and provides a safe work environment,,,https://instagram.fbkk13-2.fna.fbcdn.net/v/t51.2885-15/e35/s1080x1080/121966395_145025893997447_1154369016637651495_n.jpg?_nc_ht=instagram.fbkk13-2.fna.fbcdn.net&_nc_cat=111&_nc_ohc=BG4Zo8aHg5UAX8daOaI&tp=1&oh=24193bfd58d0d0a97b60cb28d36b77a8&oe=5FFCEE96
ashmilko-CGxvpKRAEFp.jpg,https://www.instagram.com/p/CGxvpKRAEFp,10/25/2020,ashmilko,28,0.1786,2,3,,image,"This is the group lounge at my dormitory and it relates to the HER Process Environmental Stress because when trying to work in group lounges, there tends to be a lot of noise or people which can’t be controlled so it leads to more stress. Because of the lack of control of sound and the amount of people occupying the space, I tend to work in my actual dorm room. If we had more control over noise levels, we would able to persist and continue to work in this type of environment. 
#envpsy #envpsyw1","envpsy, envpsyw1",,https://scontent-lim1-1.cdninstagram.com/v/t51.2885-15/e35/s1080x1080/122654238_115037507047030_333689699056017766_n.jpg?_nc_ht=scontent-lim1-1.cdninstagram.com&_nc_cat=110&_nc_ohc=syrCUvzszJEAX_ICQp7&tp=1&oh=0e3d7d00885ea4cd9bc29445620ac191&oe=5FFABEDF
sadiesworkspace-CGxcS3Ol2lO.jpg,https://www.instagram.com/p/CGxcS3Ol2lO,10/25/2020,sadiesworkspace,4,0.25,1,0,,image,"This is the construction site on north campus right behind my house. It relates to environmental stress because there is little control for the residents over the construction schedule and the noise it makes, possibly leading to coping with overload.
#envpsy #envpsyw1","envpsy, envpsyw1",,https://instagram.fist13-1.fna.fbcdn.net/v/t51.2885-15/e35/s1080x1080/122424973_105114411335573_6956333220708579078_n.jpg?_nc_ht=instagram.fist13-1.fna.fbcdn.net&_nc_cat=105&_nc_ohc=nisLu81OIYMAX--nHzl&tp=1&oh=3c8f6d1644c2a12890cd599ffaf27709&oe=5FFAD942
dea1500sm-CGxbIlfhajX.jpg,https://www.instagram.com/p/CGxbIlfhajX,10/25/2020,dea1500sm,6,1.1667,4,3,,image,"Environmental stress means there are too many things to deal with and you don’t have the ability to respond to all them. Living in the modern city, there is too much stimulation and we experience information overload. We develop strategies to lower stress, but it has costs for coping. Like less time for social inputs and redefine the boundary of social interaction.
The picture shows that there are no ticket sellers for the subway anymore, instead replaced by scanning automatic gate and ticket vendors.
#envpsy, #envpsyw1","envpsy, envpsyw1",,https://scontent-cdt1-1.cdninstagram.com/v/t51.2885-15/e35/121816082_797432277776242_2977505331462991590_n.jpg?_nc_ht=scontent-cdt1-1.cdninstagram.com&_nc_cat=110&_nc_ohc=019fZO21ngwAX9vYLRd&tp=1&oh=50e901be2c14abb6efc5190de53d988a&oe=5FFB1408
dea1500sm-CGxbIlfhajX.jpg,https://www.instagram.com/p/CGxbIlfhajX,10/25/2020,dea1500sm,6,1.1667,4,3,,image,"Environmental stress means there are too many things to deal with and you don’t have the ability to respond to all them. Living in the modern city, there is too much stimulation and we experience information overload. We develop strategies to lower stress, but it has costs for coping. Like less time for social inputs and redefine the boundary of social interaction.
The picture shows that there are no ticket sellers for the subway anymore, instead replaced by scanning automatic gate and ticket vendors.
#envpsy, #envpsyw1","envpsy, envpsyw1",,https://scontent-cdt1-1.cdninstagram.com/v/t51.2885-15/e35/122643219_1653309571541010_9163009279617863390_n.jpg?_nc_ht=scontent-cdt1-1.cdninstagram.com&_nc_cat=106&_nc_ohc=kN1pjrZcjUIAX8wj4Zd&tp=1&oh=eab03c9fa004abcb0a00a29252e09b93&oe=5FFD75C4
meilicornell-CGxHJgqgr8s.jpg,https://www.instagram.com/p/CGxHJgqgr8s,10/25/2020,meilicornell,3,0,0,0,,image,"This is my dorm room desk, the place where I check my (long) to-do list and oftentimes become stressed because of the demands of schoolwork and extracurricular responsibilities. In DEA, we discussed how stressors can be long term in modern times, often making us more prone to sickness and sedentary coping strategies. Because time and class assignments are pretty much out of my control, it can be difficult to manage this kind of stress without feeling the need to cope. 
#envpsy #envpsyw1","envpsy, envpsyw1",,https://instagram.fqnv2-1.fna.fbcdn.net/v/t51.2885-15/e35/s1080x1080/122597448_129201598632241_7734891517448611850_n.jpg?_nc_ht=instagram.fqnv2-1.fna.fbcdn.net&_nc_cat=101&_nc_ohc=_96zJoDsJPoAX9PUFSV&tp=1&oh=759e35dccf4e95eb4a60126923aeb98d&oe=5FFB1820
just_add_plants.20-CGwB3_3HJ28.jpg,https://www.instagram.com/p/CGwB3_3HJ28,10/25/2020,just_add_plants.20,2,0,0,0,Cornell University,image,"HER Process: Environmental Stress. This is a picture of the smoke detector in the house I rent—unfortunately it’s placed near the kitchen. The kitchen fan over the stove is broken, so anytime anyone cooks this is bound to go off. By now, we’re almost used to it. Sometimes when we cook we have the forethought to unscrew this and put it outside; usually we don’t though. Now that we’re kinda used to it, when it goes off instead of running down to see what the commotion is we just wait it out until someone takes it outside.

#envpsy #envpsyw1","envpsy, envpsyw1",,https://instagram.fsof3-1.fna.fbcdn.net/v/t51.2885-15/e35/s1080x1080/122400830_392587351769627_1697596571290536370_n.jpg?_nc_ht=instagram.fsof3-1.fna.fbcdn.net&_nc_cat=111&_nc_ohc=5XV57Vb_kqEAX-RGX4s&tp=1&oh=3a4124a91a471876f9720607ed5b0d02&oe=5FFB3B28
dea_1500-CGvzicOHe8Q.jpg,https://www.instagram.com/p/CGvzicOHe8Q,10/25/2020,dea_1500,7,1.5714,5,6,,image,"Where I work is related to the HER process of environmental stress. I actually prefer to work in my dorm room because I am unable to control the noise in the lounge. Often times, small groups of students will be talking loudly and I get distracted. Other times someone plays a piano. I’m unable to focus on my work due to lack of control over the noise, get frustrated and have move back to my room where I can control the noise levels.
#envpsy #envpsyw1","envpsy, envpsyw1",,https://instagram.fkul14-1.fna.fbcdn.net/v/t51.2885-15/e35/s1080x1080/122414949_171316704613849_3817394465968314902_n.jpg?_nc_ht=instagram.fkul14-1.fna.fbcdn.net&_nc_cat=101&_nc_ohc=UXskamuX6roAX-ZVemB&tp=1&oh=c7617e845dbca2f52ea7df6dc8ae3114&oe=5FFAEFF8
wmr_43-CGvp66XLO4l.jpg,https://www.instagram.com/p/CGvp66XLO4l,10/24/2020,wmr_43,2,0,0,0,"Collegetown, Ithaca",image,#envpsy #envpsyw1 An example of noise.  The main streets of college town are very loud at night.  Can lead to sleep disturbance.,"envpsy, envpsyw1",,https://instagram.flju2-1.fna.fbcdn.net/v/t51.2885-15/e35/s1080x1080/122429946_2778664475785522_1316793729513426994_n.jpg?_nc_ht=instagram.flju2-1.fna.fbcdn.net&_nc_cat=110&_nc_ohc=7nuN9DrmoxQAX9blPfT&tp=1&oh=ea73ed244f08fd3ffbb873cc06cb115f&oe=5FFCBE57
sophieharris.envpsy-CGu5xpsHLGU.jpg,https://www.instagram.com/p/CGu5xpsHLGU,10/24/2020,sophieharris.envpsy,8,0,0,0,Libe Slope,image,"This photo is an example of environmental perception, the HER process where humans acquire and reorganize sensory information. This photo illustrates environmental perception as a constructive process because the photo does not capture the Slope as I saw it. This shows that our eyes are not like cameras because of environmental perception. #envpsy #envpsyw1","envpsy, envpsyw1",,https://instagram.fbkk12-1.fna.fbcdn.net/v/t51.2885-15/e35/s1080x1080/122267391_402783507562129_523652406909067664_n.jpg?_nc_ht=instagram.fbkk12-1.fna.fbcdn.net&_nc_cat=101&_nc_ohc=WnpfsnXT7y4AX_xrV0l&tp=1&oh=0d704a4b82dbb736a30ecae68f78d43a&oe=5FFDCAF6
kobi_1500-CGtJdUvAiqQ.jpg,https://www.instagram.com/p/CGtJdUvAiqQ,10/24/2020,kobi_1500,9,0.5556,3,2,,image,"this is an example of coping with environmental stress. after a long, hard day of school work, these 3 tired students plop themselves down on a couch, becoming sedentary for the rest of the night. #envpsy #envpsyw1","envpsy, envpsyw1",,https://instagram.fsof9-1.fna.fbcdn.net/v/t51.2885-15/e35/p1080x1080/122100939_428829644748028_1029011875769735907_n.jpg?_nc_ht=instagram.fsof9-1.fna.fbcdn.net&_nc_cat=104&_nc_ohc=m2YR2lkLji0AX_yF4Da&tp=1&oh=7e2c094ab6f8b921ca12fd9beb475881&oe=5FFA9238
